uuid,course_code,course_acronym,course_name,dept_acronym,description,credits,prerequisites,antirequisites,semester,semester_type,professor_allocated,schedule,related_course_codes,created_at,updated_at,suitable tags
74f3a953-e6e3-4636-a906-11a72364be39,DES527,UDXR,User Experience Design of XR,DES,"This course covers the user experience (UX design) fundamentals for XR (i.e., Augmented / Virtual/ Mixed Reality). Aspects related to the human-centered design process, 3D interactions and Interface Design, and human-factors issues associated with XR will be discussed. The course will briefly cover the development of AR/VR applications using Unity. This hands-on, project-based course with an emphasis on prototyping, testing, and evaluating the XR applications.",4,"DES102,CSE101",,5,monsoon,Anmol Srivastava,"[{""day"": ""Monday"", ""end_time"": ""18:00"", ""start_time"": ""16:30""}, {""day"": ""Wednesday"", ""end_time"": ""18:00"", ""start_time"": ""16:30""}]",,52:19.3,52:19.3,"ux-design, extended-reality, vr-ar, interaction-design, hci, immersive-media"
75168e46-675a-4b92-a007-ef8b7100506e,ECO341,MDP,Markov Decision Processes,SSH,"Dynamic programming techniques are usefully applied in dynamic models of economics, game theory, operations research and engineering. This course develops the Bellman's principle of optimality in some prominent formulations of the dynamic programming model with a finite/countable state space and discrete time. Some leading applications are discussed as illustrations of the solution methodology.",4,"MTH100,MTH201,MTH203",,,monsoon,TBA,[],ECO541,52:19.3,52:19.3,"mdp, reinforcement-learning, dynamic-programming, decision-theory, stochastic-control"
77918887-f339-4c9a-99cb-c706a39db8cd,CSE5GP,GP,Geometry Processing,CSE,"This course is about providing a structured learning of digital shape representation and processing. 3D shapes around us can be acquired through various means. We will learn about data structures to efficiently store these shapes in digital form, theoretical background to understand various properties of curves and surfaces, analysis and editing of shapes. Understanding geometric representations and manipulations have wide applications in scientific simulations, spatial data analysis, CAD/CAM, computer game develepment, medical imaging, computer vision, and 3D printing.",4,CSE101,,,monsoon,TBA,[],,52:14.0,52:14.0,"geometry-processing, 3d-modeling, mesh-optimization, computer-graphics, numerical-geometry"
78e1874c-ab03-4887-bc9d-2d99a09a0af7,MTH506,TML,Topics in Mathematical Logic,MTH,"This course is a sequel to IML (MTH 300) and will begin with relational structures as interpretations for first-order languages. We will discuss the relationship between, on one hand mathematical theories, described in formal languages, and on the other, mathematical structures realizing those theories. This will be followed by detailed discussions on Gödel’s completeness theorems and its corollaries thus entering into what is known as Model Theory. We will discuss the Löwenheim-Skolem theorems, categoricity, model completeness, decidability, quantifier elimination.",4,MTH300,,,monsoon,TBA,[],,52:16.5,52:16.5,"mathematical-logic, proof-theory, model-theory, set-theory, computability, logic-foundations"
79044f92-32db-4124-b0f4-a27ad1c06980,ECO313,MD,Market Design,SSH,"The theory of auctions has been one of the most important successes of applied game theory. It has become a central institution for resource allocation in real world markets; instrumental in allocating resources as varied as natural resources, spectrum rights, electricity generating capacity and more. This course aims to prepare the students to be able to analyze auctions and internet marketplaces using tools from economics and game theory.",4,ECO311,,,winter,TBA,[],,52:19.3,52:19.3,"market-design, game-theory, auctions, matching-theory, economic-systems, incentive-analysis"
7a6dd070-53b4-40df-b512-ad8bd71ae108,SSH240,PDE,Politics in Digital Era,SSH,"Popular accounts like the one by a former Google CEO of the 'new digital age' tend to underestimate the role of state institutions. This course helps to address this gap by conceptualising the rise of digital technologies in relation to the theories of power, in particular, the disruptive nature of technological change for the state. In this introductory course, we begin by considering the theoretircal foundations of the state by reviewing core concepts grounded in political science. In the first part, we conceptualize the idea of the state through diverse lenses, including international relations, political economy a well as theories of knowledge/power and the way these have conceptualized technological change. Drawing on in-depth case studies of impact of the digital, we then develop the idea of 'disruptive power' as a driving force of politics in the digital era. In the second part of the course we consider the how such 'disruptive power' is being exercised, and also resisted across various contexts. Along the way we explore the major crises in world politics, including humanitarian issues, fake news, surveillance and the impact of AI.",4,,,3,monsoon,Aasim Khan,"[{""day"": ""Monday"", ""end_time"": ""18:00"", ""start_time"": ""16:30""}, {""day"": ""Wednesday"", ""end_time"": ""18:00"", ""start_time"": ""16:30""}]",,52:21.9,52:21.9,"digital-politics, cyber-activism, surveillance, political-communication, data-politics, tech-policy"
7a86c6d5-e066-41bd-b791-a8eaf8af1063,PSY302,SP,Social Psychology,SSH,"The course is an exploration of the prevailing theories, topics and empirical methods in the study of Social Psychology. It will specifically focus on five main areas: the science of Social Psychology and its theoretical foundations ; research methods used in Social Psychology research ; the individual in context to the social world ; an individual's impact on another individual or group/s ; The dynamics of social relationships.",4,,,6,winter,Dr Ratan Suri,"[{""day"": ""Tuesday"", ""end_time"": ""18:00"", ""start_time"": ""16:30""}, {""day"": ""Thursday"", ""end_time"": ""18:00"", ""start_time"": ""16:30""}]",,52:19.3,52:19.3,"social-psychology, behavior, attitudes, group-dynamics, social-influence, interpersonal-relations"
7ab3d588-5277-46f1-9442-867d4796af22,SSH124,CT,Critical Thinking,SSH,"This course introduces the learner to the fundamentals of critical thinking and informal logic. We will use a ‘mixed’ instructional methodology that includes lecture, Q&A, learning team activities, discussion of videos, slides, print articles and the text.",4,,SSH101,6,winter,TBA,[],,52:21.9,52:21.9,"critical-thinking, logic, reasoning-skills, argument-analysis, philosophy, cognitive-biases"
7ab78642-b047-42a6-b2b3-3fc28045fe6e,ECE538,WN,Wireless Networks,ECE,"This course will cover a variety of mobile systems (wireless LANs, cellular systems, and sensor networks). This course will cover design of various layers in the network stack in the context of wireless communication. This course will cover challenges in mobile systems.",4,CSE232,,,winter,TBA,[],CSE538,52:14.0,52:14.0,"wireless-networks, wifi, 5g, mac-protocols, routing, mobile-communication"
7abf0d1d-926a-4eb6-97e6-65bc7977b5be,ECE347,ADC,Advanced Digital Communications,ECE,"This course will introduce students to the fundamental blocks that constitute a digital communication system. Starting with an introduction to source coding and characterization of communication signals and systems, the students will study the functionalities of the blocks such as Digital Modulator/ Digital Demodulator and Channel Encoder-Decoder. The performance of various digital modulation schemes along with the development of optimum receivers in the AWGN channel will be discussed. Further topics related to carrier synchronization and channel equalization shall be elaborated. Moreover, the course will also highlight the trade-off associated with bandwidth and power for linear block codes and digital modulation schemes.",4,ECE240,,,monsoon,TBA,[],ECE547,52:16.5,52:16.5,"digital-communications, modulation-coding, mimo, channel-capacity, communication-theory"
7bdcdfca-d768-41ed-b914-df2b81d7d47b,BIO524,BIP,Biomedical Image processing,BIO,"The Biomedical image processing course is meant to impart knowledge on medical and biomolecular imaging. The course introduces physical, engineering and signal processing principles needed for medical imaging and image processing. The primary focus of this course will be computational image processing methods. This course covers topics on analysis of medical images from different types of sources such as planar x-ray, x-ray computed tomography (CT), magnetic resonance imaging (MRI), nuclear medicine imaging - positron emission tomography (PET), light and confocal microscopy and electron microscopy. Students will also gain hands on experience with medical image processing software to process CT or MRI scans and construct 3D models from microscopic images.",4,,,,monsoon,TBA,[],,52:19.3,52:19.3,"biomedical-imaging, image-processing, mri, ct-scan, segmentation, medical-data-analysis"
7e1d5085-3a66-49c2-acd4-1685e01f2467,CSE662A,SCV,Special Topics in Computer Vision,CSE,This is an advanced course on Computer Vision offered to undergraduate and graduate students. The goal is to develop an understanding of a few selected topics in computer vision and enable students to understand and develop applications using existing tools. Students will be given theoretical and programming assignments targeted towards solving real-world computer vision problems.,4,ECE350,,,winter,TBA,[],,52:14.0,52:14.0,"computer-vision, deep-learning, object-detection, image-segmentation, visual-perception"
7e5bce21-dae1-4c77-906b-fa5d61eb987f,DES102,IHCI,Introduction to HCI,DES,"This course will provide a theoretical and practical understanding of human-computer interaction (HCI) design including concepts of user centered and design thinking, usability, interfaces, rapid prototyping, and evaluation. This is a project-based course where students can work on different user-centric prototypes.",4,,,1,monsoon,Sonal Keshwani / Pragma Kar,"[{""day"": ""Tuesday"", ""end_time"": ""11:00"", ""start_time"": ""09:30""}, {""day"": ""Thursday"", ""end_time"": ""11:00"", ""start_time"": ""09:30""}]",,52:16.5,52:16.5,"hci, user-centered-design, usability, interface-evaluation, interaction-design, design-principles"
7ebfe005-e3d9-450e-add7-e02fc6601b00,BIO321,ABIN,Algorithms in Bioinformatics,BIO,"This course introduces undergraduates to the outstanding promise of applied algorithmics in the field of molecular biology and human health. The course aims to bridge the gap between algorithmic thinking and biological problem-solving. As part of this course, the students will be encouraged to design algorithms and apply on real biological datasets to gain fundamental insights into biological systems/diseases. The students will get an opportunity to deep dive into the vibrant realm of high throughput molecular biology through the lense of multi-omics data analysis.",4,,,5,monsoon,Debarka Sengupta,"[{""day"": ""Wednesday"", ""end_time"": ""12:30"", ""start_time"": ""11:00""}, {""day"": ""Friday"", ""end_time"": ""11:00"", ""start_time"": ""09:30""}]",,52:19.3,52:19.3,"geometry-processing, surface-reconstruction, mesh-simplification, discrete-differential-geometry"
80455d63-91cf-47d1-a2bd-509a46b79e5d,CSE202,DBMS,Fundamentals of Database Management System,CSE,"This is a first course on database systems at the undergraduate level, covering fundamentals concepts, aspects of database design, database query languages and database system implementation. Students are taught concepts and algorithms in a general setting that is not tied to any one particular database system. The course emphasizes both theory and application of database systems. The course includes hands-on experience of designing and using databases, and building small database-backed applications.",4,CSE102,,4,winter,Mukesh Mohania / Vikram Goyal,"[{""day"": ""Monday"", ""end_time"": ""12:30"", ""start_time"": ""11:00""}, {""day"": ""Wednesday"", ""end_time"": ""12:30"", ""start_time"": ""11:00""}]",,52:14.0,52:14.0,"Introductory Course, Database Fundamentals, SQL Programming, Entity-Relationship Modeling, Transaction Control, Data Normalization, Relational Database Design"
8085adfb-a65a-4aa6-89c2-4562c257581c,SSH324,PoM,Philosophy of Mind,SSH,"What is the nature of mind/consciousness - is it immaterial or material, or both? How do we understand the relation between the mind, brain and the body on the one hand, and the mind and the external world, on the other? What is it to have a mental representation or a 'thought'? Are such mental representations, intentional states, and 'experiencing' itself (such as experiencing pain) inseparable from self-consiousness, such that without self-consciousness there can be no consciousness? Can 'thinking' be processively or functionally reproduced in computers? Is the possibility of such reproduction essential to fully grasping what the mind is? These are some of the issues that this course will investigate, by first situating them within the broader epistemological and ontological debates in which they arose, before turning to more contemporary approaches and theoretical responses.",4,SSH121,,6,winter,TBA,"[{""day"": ""Monday"", ""end_time"": ""18:00"", ""start_time"": ""16:30""}, {""day"": ""Wednesday"", ""end_time"": ""18:00"", ""start_time"": ""16:30""}]",,52:21.9,52:21.9,"Philosophy Core, Mind-Body Problem, Cognitive Theories, Metaphysics, Consciousness Studies, Neuroscience Interface, Epistemological Inquiry"
808bf6ba-4265-4a9e-a092-6c10d94e56cf,BIO523,CHI,Chemoinformatics,BIO,"he objective of this course is to provide introduction to chemoinformatics, an interdisciplinary area on the interface of chemistry, informatics and biology. The student will be provided with understanding of fundamentals of chemoinformatics and its applications. Through lectures, hands-on exercises and assignments, the student is expected to achieve a good grasp of the concepts and applications of chemoinformatics.",4,,,5,monsoon,Arul Murugan,"[{""day"": ""Wednesday"", ""end_time"": ""12:30"", ""start_time"": ""11:00""}, {""day"": ""Friday"", ""end_time"": ""11:00"", ""start_time"": ""09:30""}]",,52:19.3,52:19.3,"Chemical Data Science, Drug Design, Molecular Descriptors, QSAR, Bioinformatics Applications, Computational Chemistry, Data-Driven Chemistry"
80d0a20f-d1b5-4082-a9b3-2000ef43c776,PSY307,NDM,Neuroscience of Decision Making,SSH,"The course will introduce how perception, goals, preferences, motivation of living systems guide their selection of actions and thoughts from several possible options. The course will try to build a mechanistic understanding of the processes in the brain that support decision making and how they are flexibly updated in a dynamically changing environment. Classes will discuss relevant scientific & historical background, salient theoretical models and experimental evidence in various aspects of decision-making. An additional component will involve computational analysis of experimental datasets in this field to make inferences about brain and behaviour. The primary effort would be to make neural mechanisms accessible to the learners, expose them to possible applications and encourage them to find their own avenues of interest for translating the core principles of decision neuroscience.",4,,,5,monsoon,Mrinmoy Chakrabarty,"[{""day"": ""Monday"", ""end_time"": ""11:00"", ""start_time"": ""09:30""}, {""day"": ""Wednesday"", ""end_time"": ""11:00"", ""start_time"": ""09:30""}]",PSY507,52:19.3,52:19.3,"Cognitive Neuroscience, Brain and Behavior, Neuroeconomics, Decision Psychology, Experimental Design, Neural Decision Systems"
814712f4-1cad-4168-b8e2-83c15e8c258f,ECE323,,Intelligent Product Design Workshop,ECE,"The goal of this workshop style course is to help students move from TRL 3 ideas and Proof of Concepts to TRL 5/6 Industry relevant prototypes. The students will be required to develop their proof of concept into an aesthetically pleasing, ergonomically sound, and user-friendly intelligent product. The course builds upon courses like ESD/ PIS and reviews design concepts and teaches skills like Optimizing Bill of Materials, ensuring manufacturability and testability and repairability - aspects which are very important and relevant when moving from a PoC stage to a prototype stage. The 8-10 week workshop is intended to be run in summer semesters with support from Centre for Intelligent Product Development (CiPD) and Industry Partners wherever needed.",4,,,,monsoon,TBA,[],EVE323/ECE526,52:16.5,52:16.5,"Hands-on Learning, Embedded Design, IoT Devices, Rapid Prototyping, Smart Product Development, Human-Centered Design, Industry-Focused Skills"
815f4cbf-7208-4529-a4e5-e79b16edd4b0,CSE233,NAD,Network Administration,CSE,"This course is intended for second year B.Tech students, who wish to improve skills through hands-on experience in network administration. This course is a follow up of the course on System Administration. Students’, who successfully complete these courses, will be offered part-time work for System and Network Admin in the institute and will be expected to work for at least two semesters.",4,,,,winter,TBA,[],,52:14.0,52:14.0,"Network Fundamentals, Linux Configuration, TCP/IP Protocols, Routing & Switching, Firewalls & Security, Practical Networking Skills"
81b1e21b-896d-4c91-87f5-db8fec72278a,CSE606,DW,Data Warehouse,CSE,"The international market for Business Intelligence and Data warehouse is increasing rapidly and is currently estimated to be in hundreds of billion of US dollars. A number of Indian companies, even in NCR of Delhi, are already carrying out projects in the area. Yet, there is an acute shortage of skilled human resources in the subject and the course attempts to plug this gap. Students will be taken over the development life cycle of a data warehouse. The application environment in which a data warehouse is embedded shall be brought out so that the value of the new technology is clearly discernible.",4,CSE202,,,winter,TBA,[],,52:14.0,52:14.0," Data Engineering, OLAP Systems, Business Intelligence, ETL Pipelines, Dimensional Modeling, Data Storage Solutions"
84bca89b-b33b-46b0-91d9-3387cd1c3e61,MTH517,CMO,Combinatorial Optimization,MTH,"Combinatorial Optimization studies the structures and algorithms underlying discrete optimization problems. A central role in combinatorial optimization is played by polyhedral techniques, namely the representation of combinatorial problems as optimization problems over polyhedra or convex bodies and using the geometry to give insight into the combinatorial problems. The course will be a mix of basic and advanced topics in this area.",4,,,,winter,TBA,[],,52:16.5,52:16.5,"Discrete Optimization, Graph Algorithms, Integer Programming, Network Flows, Complexity Analysis, Theoretical Computer Science"
853946cf-46bb-4350-b06b-1e47fccc8e77,DES529,DAIDP,Design for Artificial Intelligence driven Products,DES,"Designing for AI means designing for a human-machine relationship that is in flux; this contrasts with non-AI design where the relationship is static. AI-driven products bring together a collection of technologies (machine learning, knowledge representation and reasoning, natural language processing, computer vision, and robotics) to endow machines with increasingly human-like physical, cognitive, and emotional capabilities. AI-driven products can learn from user behavior patterns and personalize the experience of a consumer. The evolution of human-machine interactions from a context where the human adapts to the machine and the machine does not (i.e., traditional human-machine interaction), to a context where the human and the machine learn from and adapt to each other requires conceptualization about the nature of relationships consumers have with AI-driven products.",4,,,6,winter,Vinish Kathuria,"[{""day"": ""Tuesday"", ""end_time"": ""16:30"", ""start_time"": ""15:00""}, {""day"": ""Thursday"", ""end_time"": ""16:30"", ""start_time"": ""15:00""}]",,52:19.3,52:19.3,"AI Integration, UX/UI for ML Systems, Human-AI Interaction, Design Thinking, Product Innovation, Applied HCI, Intelligent Systems"
85b0758e-57db-452d-a31d-553aa55b0ef0,ECE581,AD,Autonomous Driving,ECE,"The goal of this course is to provide hands-on-experience in implementing several modules of autonomous driving through software-in-the-loop and hardware-in-the-loop. This is a project-based course and covers modules on perception, path planning, and vehicle control for autonomous driving. The course is mainly designed towards implementation and hence intensive programming is involved in C++ or Python. The course will use Mahindra e20 and auto-rickshaw as the hardware testbeds.",4,,,,winter,TBA,[],,52:16.5,52:16.5,"Self-Driving Technologies, Sensor Fusion, Perception & Control, AI for Robotics, Real-Time Systems, Automotive Engineering"
86637644-3495-46bd-8fed-53db74326a4a,CSE664,LLM,Large Language Models,CSE,"In recent years, Large Language Models (LLMs) have become integral to the field of Natural Language Processing (NLP), significantly enhancing the performance of essential NLP tools. This course offers a comprehensive introduction to language modeling and its diverse applications, providing a self-contained overview. Starting with the foundational probabilistic principles of language models, the course delves into the formal and theoretical aspects of what defines a language model. This all-encompassing program empowers participants with the essential knowledge and skills to effectively utilize LLMs. Covering theoretical principles and practical applications, the course provides a complete grasp of LLMs and their varied real-world applications. The course introduces recent literature in different areas related to LLMs in a seminar style. The students registering for this course should have basic knowledge in DL.",4,"CSE556, ECE553, CSE516, ECE559, ECE677, CSE677",,5,monsoon,Rajiv Ratn Shah,"[{""day"": ""Tuesday"", ""end_time"": ""18:00"", ""start_time"": ""16:30""}, {""day"": ""Thursday"", ""end_time"": ""18:00"", ""start_time"": ""16:30""}]",,52:14.0,52:14.0,"Natural Language Processing, Generative AI, Transformers, Prompt Engineering, Deep Learning Models, LLM Applications"
871e31bf-eb41-4c0f-9f09-38568d5dddfa,CSE609,SComp,Statistical Computation,CSE,The objective of this course is to provide knowledge about concepts and methods of statistical analysis. Data can be generated by machine or manually collected during surveys. All kinds of data-sets need analysis to the point such that we can make conclusions about the trend in the data. Hence statistical modelling and inference is often needed. Recently multiple kinds of statistical modelling approach have been suggested. Some statistical methods have been implemented as tools while some are implemented by users according to need of data-analysis. This course would provide the basics of statistical inference and methods introducing some computational techniques to perform modelling of systems. Through this course student will also learn about weakness and strength of such statistical modelling methods which could guide them to distinguish or develop suitable analysis techniques.,4,MTH201,,,winter,TBA,[],,52:14.0,52:14.0,"Applied Statistics, Monte Carlo Simulations, Data Modeling, R & Python Programming, Hypothesis Testing, Statistical Algorithms"
8861629d-abf5-44b2-96c9-5fe71f8330c8,CSE569,CldC,Cloud Computing,CSE,"This course will provide an introduction to cloud computing from architectural and design perspectives. In particular, the course will discuss underlying infrastructure and architecture of clouds, techniques for enabling services and the quality of such services, as well as issues in designing clouds. Selected research issues in performance, security, and management would also be discussed. Students are expected to learn and understand tools and techniques for using, designing, and implementing clouds and services via assignments.",4,CSE232,,,monsoon,TBA,[],,52:14.0,52:14.0,"Scalable Computing, AWS/GCP/Azure, Virtualization, Containerization, Distributed Systems, Cloud Architecture, DevOps Tools"
89a7b0ef-3b7b-451a-8eb6-23f8afed8579,SSH326,JALang,Japanese Language,SSH,"The objective is to learn the basics of the Japanese language and how to communicate in Japanese. The students will acquire a primary understanding of Japan through studying Japanese culture. 1) The students should attend the classes regularly, and before attending the class they should study the required vocabulary using the provided video and the textbook. 2) The students should submit homework regularly. 3) Class tests will be conducted in every class, and the marks will be added to the results of the Final Test. 4) This course is a Hybrid course (Offline / Online).",4,,,,winter,TBA,[],,52:19.3,52:19.3,"Language Proficiency, Japanese Culture, Script Reading (Hiragana/Katakana), Conversational Skills, Grammar Basics, Cultural Studies"
8a1a728a-eaac-4c50-85f6-202db54eed85,BIO512,FOMB,Foundations of Modern Biology,BIO,"The aim of this basic core course is to provide students a good background in genetics and molecular biology. The major focus is to : cover most important concepts in genetics like Mendelian laws, linkage and recombination ; cover molecular mechanisms of gene expression ; solve qualitative and quantitative problems in population and evolutionary genetics.",4,,"BIO601,BIO214",5,monsoon,Vibhor Kumar,"[{""day"": ""Monday"", ""end_time"": ""18:00"", ""start_time"": ""16:30""}, {""day"": ""Wednesday"", ""end_time"": ""18:00"", ""start_time"": ""16:30""}]",,52:19.3,52:19.3,"Life Sciences Core, Molecular & Cell Biology, Genetics, Biological Systems, Biochemistry Fundamentals, Evolutionary Concepts"
