uuid,course_code,course_acronym,course_name,dept_acronym,description,credits,prerequisites,antirequisites,semester,semester_type,professor_allocated,schedule,related_course_codes,created_at,updated_at,suitable tags
341bdc08-cb2a-4581-b182-2bd958a34d6d,CSE354,NSS-II,Networks and System Security II,CSE,"This course derives is sequel to the Networks and Systems Security (CSE352/552) that was taught in Winter 2019. The core theoretical concepts build up on where Networks and System Security left. However, a significant volume of the course material focuses largely on hands-on networks and systems security tools, and how to use them to exploit network and system vulnerabilities, besides the traditional system development exercises.",4,"CSE231,CSE232",,6,winter,Sambuddho Chakravarty,"[{""day"": ""Tuesday"", ""end_time"": ""18:00"", ""start_time"": ""16:30""}, {""day"": ""Thursday"", ""end_time"": ""18:00"", ""start_time"": ""16:30""}]",CSE554,52:14.0,52:14.0,"network-security, cryptography, intrusion-detection, secure-communication, system-vulnerabilities, cybersecurity-protocols, firewalls"
354b0de8-ea76-4f35-8df4-404bbc89d104,PSY308,CMM,Cognition of Motor Movement,SSH,"Motor movement corresponds to various kinds of movement that we execute in everyday life like hand movements (reaching, grasping), eye movements, walking etc. A comprehensive understanding of human motor system would help in engineering better tools, systems, robots, neuroprosthetics etc. This course work is designed to start with the introduction to the human motor system, different types of action or movement like; grasping, reaching, spatial navigation, eye-movement etc. This will be followed by understanding of the mechanics, neurophysiology and psychology of action planning and execution.",4,,,5,monsoon,Sonia Baloni Ray,"[{""day"": ""Tuesday"", ""end_time"": ""16:30"", ""start_time"": ""15:00""}, {""day"": ""Thursday"", ""end_time"": ""16:30"", ""start_time"": ""15:00""}]",PSY508,52:19.3,52:19.3,"motor-cognition, neuroscience, movement-control, brain-body-interface, motor-learning, cognitive-psychology, neurophysiology"
3557213d-56d9-4a74-bb97-ae06b8627f90,CSE511,CA,Computer Architecture,CSE,"This course forms a strong foundation in the understanding and design of modern computing systems. Building on a computer organization base, this course explores techniques that go into designing a modern microprocessor. Fundamental understanding of computer architecture is key not only for students interested in hardware and processor design, but is a foundation for students interested in compilers, operating systems, and high performance programming. This course will explore how the computer architect can utilize the increasing number of transistors available to improve the performance of a processor. Focus will be given to architectures that can exploit different forms of parallelism, whether they be implicit or explicit. This course covers architectural techniques such as multi-issue superscalar processors, out-of-order processors, Very Long Instruction Word (VLIW) processors, advanced caching, and multiprocessor systems.",4,,,5,monsoon,Sujay Deb,"[{""day"": ""Wednesday"", ""end_time"": ""12:30"", ""start_time"": ""11:00""}, {""day"": ""Friday"", ""end_time"": ""11:00"", ""start_time"": ""09:30""}]",ECE511,52:14.0,52:14.0,"computer-architecture, pipelining, instruction-set, memory-hierarchy, cpu-design, microarchitecture, hardware-performance"
363e2fb7-5470-4b1a-9a4d-0df3df1f83a9,MTH551,QIT,An Introduction to Quantum Information Theory,MTH,"The course aims to equip students with the prerequisites — mathematical, quantum-mechanical, and information-theoretical — for understanding and further studying, in both academic as well as industry settings, the broad field of quantum information theory and quantum computing. The focus will be on the formal presentation of the various definitions, theorems and proofs, and these will be supplemented with a wide-variety of examples and exercises.",4,,,,winter,Satish Pandey,"[{""day"": ""Monday"", ""end_time"": ""16:30"", ""start_time"": ""15:00""}, {""day"": ""Wednesday"", ""end_time"": ""16:30"", ""start_time"": ""15:00""}]",,52:16.5,52:16.5,"quantum-information, quantum-computing, entanglement, qubits, quantum-entropy, quantum-algorithms, quantum-cryptography"
3648fad9-0cc7-4359-bb8f-53b375c54380,DES513,WARDI,"Wearable Applications, Research, Devices, Interactions",DES,"This is a course about the current paradigm of Wearable Computing. In this course, we will cover the origins, pioneering contributions, and principles of Wearable Computing. With this foundation, we will initiate our exploration into the space by learning how to design physical (device form factor), digital (applications) as well as human (interaction techniques) aspects of Wearables. You will develop the skills needed to conduct design of these three interrelated elements and also get a chance to apply them on short assignments and student-selected group projects. We will also discuss and critique both seminal and cutting-edge research in the domain to help you identify opportunities for new research that may begin with your class projects.",4,,,,monsoon,TBA,[],,52:19.3,52:19.3,"wearable-tech, human-computer-interaction, biosensors, wearable-design, user-centered-research, body-computing, smart-devices"
37144fe2-7a8e-4e7b-b3ce-1beeb996ea60,CSE600A,OOPD,Object Oriented Programming and Design,CSE,"It is a 2 credit postgraduate level core course in advanced object oriented programming, designed to improve programming skills, and ability to use contemporary software development practices and tools. The course curriculum focuses on large software development, collaborative development environment, automatic testing and deployment, common libraries and continuous integration. It also aims to enhance the quality of design in terms of scalability and maintainability with design principles and design patterns. Along with course, students get an opportunity to learn development tools like IDEs and common frameworks.",2,,,,monsoon,TBA,[],ECE600A,52:14.0,52:14.0,"oop, object-oriented-design, encapsulation, inheritance, polymorphism, uml, design-patterns, class-diagrams"
37219fea-038c-47d0-b5e3-cd07301b2cf3,CSE568,SNA,Social Network Analysis,CSE,"Networks are a fundamental tool for modeling complex social, technological, and biological systems. Coupled with the emergence of online social networks and large-scale data availability in social sciences, this course focuses on the analysis of massive networks which provide many computational, algorithmic, and modeling challenges. The course will cover recent research on the structure and analysis of such large networks and on models and algorithms that abstract their basic properties. We will explore how to practically analyze large-scale network data and how to reason about it through models for network structure and evolution. Topics covered in this course how information spreads through society; robustness and fragility of networks; algorithms for the World Wide Web; prediction and recommendation in online social networks; representation learning for large networks; etc.",4,"CSE222,CSE101,MTH201",CSE559,,winter,TBA,[],,52:14.0,52:14.0,"social-networks, graph-analysis, network-metrics, centrality, community-detection, network-visualization, diffusion-models"
3731e2c1-b560-4751-a775-9d18520c8cf6,DES514,DAVP,Digital Audio & Video Production Workflow,DES,"This hands-on project-based course will introduce students to the world of Digital Audio and Video Production Workflow. Topics include Studio Miking techniques, Audio mixing using various DAW, Foley Sounds & Designing, Mutitrack Mixing, Video Production Workflow, Hands on Multicam setup and lighting techniques, Chroma Keying, Video Editing with Davinci Resolve. Students will learn to record and mix audio using industry standard practice and also learn about the video production workflow, multicam shoots using varuous equiptments (Gimbal crane, Sliders etc), In this course the students will conduct their own audio-video projects inspired by the current work being done in the field of computer music & video production.Weekly assignments will be given. record and mix audio using industry standard practice and also learn about the video production workflow, multicam shoots using varuous equiptments (Gimbal crane, Sliders etc), In this course the students will conduct their own audio-video projects inspired by the current work being done in the field of computer music & video production.Weekly assignments will be given. Students will be evaluated on both technical and creative ability in this course.",4,,,5,monsoon,Aman Samuel,"[{""day"": ""Tuesday"", ""end_time"": ""18:00"", ""start_time"": ""16:30""}, {""day"": ""Thursday"", ""end_time"": ""18:00"", ""start_time"": ""16:30""}]",,52:19.3,52:19.3,"audio-production, video-editing, digital-media, media-workflows, production-tools, storytelling, sound-design, visual-composition"
375ada9b-3a37-4af3-99e2-ff9174fa68b0,BIO361,BioP,Biophysics,BIO,"This biophysics course shall delve into concepts of physics acting upon biomolecules, primarily proteins. From understanding protein folding to predicting 3-dimension structures from the 1-dimension sequence, the course shall involve assignments that shall give the students the neccessary knowledge to deal with structural problems.",4,,,5,monsoon,Arjun Ray,"[{""day"": ""Monday"", ""end_time"": ""12:30"", ""start_time"": ""11:00""}, {""day"": ""Thursday"", ""end_time"": ""12:30"", ""start_time"": ""11:00""}]",,52:19.3,52:19.3,"biophysics, molecular-dynamics, protein-structure, physical-biology, cellular-mechanics, thermodynamics-of-life, biomolecular-modeling"
379ac682-014e-4737-9371-ef76debaad19,SOC504,AO,On the making of anthropological objects,SSH,"What is it that anthropologists do? A trivial, rather disappointing answer, is that anthropologists are engaged in the creation of anthropological objects, by talking, writing, and by ""doing research"". This course seeks to examine how anthropological objects are made, through a careful examination of a series of case studies and through critical texts written by anthropologists on their practices of making knowledge. Although located within the intellectual history of anthropology, the course may be of value to students in allied disciplines, with an interest in problems of philosophy of knowledge. This is an advanced class and may be best suited for students already engaged in research projects. The class will be conducted as a discussion-led symposium centered around 1 or 2 scholarly texts, which are to be read before class. Attendence to the classes is mandatory for success in this course. The course begins with two contrasting anthropological works, one recent (on online poker), the other, an eighty year old classic of the discipline (on the social and political structure of an African ""tribe""). Despite the obvious contrast in their objects of analysis, both these texts are ""anthropologies"". This course is motivated by the hypothesis that how or why something becomes an object of analytical interest for anthropology, is not at all obvious at first glance. By the end of the course, students setting out to constitute their own research problems, will be able to draw on these critical tools to examine the conditions that make possible the anthropologization of their own objects of interest.",4,,,6,winter,TBA,[],SOC701,52:21.9,52:21.9,"anthropology, material-culture, ethnography, cultural-production, social-construction, anthropology-of-things, artifact-studies"
37b2e9f1-118a-45c0-8a71-802db558085a,BIO214,GMB,Genetics and Molecular Biology,BIO,"The aim of this basic core course is to provide students a good background in genetics, molecular biology. The major focus is to acquaint students with quantitative aspect of different kind of genetic inheritance and horizontal transfers. The course is also to provide introduction about different aspect of molecular aspect of gene regulation.",4,,,3,monsoon,Gaurav Ahuja,"[{""day"": ""Monday"", ""end_time"": ""11:00"", ""start_time"": ""09:30""}, {""day"": ""Wednesday"", ""end_time"": ""11:00"", ""start_time"": ""09:30""}]",,52:19.3,52:19.3,"genetics, dna-replication, gene-expression, transcription, translation, molecular-biology, genome-structure, recombinant-dna"
3803f866-abb0-4642-b2af-bc074b230b22,ECE230,F&W,Fields and Waves,ECE,"This is an introductory course to electrodynamics (along with electrostatics and magnetostatics). This course will serve as a foundational course for students interested in working in RF and micro-wave, millimeter wave and optical systems.",4,MTH203,,4,winter,Sayak Bhattacharya,"[{""day"": ""Monday"", ""end_time"": ""12:30"", ""start_time"": ""11:00""}, {""day"": ""Wednesday"", ""end_time"": ""12:30"", ""start_time"": ""11:00""}]",,52:16.5,52:16.5,"electromagnetics, electric-fields, magnetic-fields, wave-propagation, maxwell-equations, antennas, transmission-lines"
3826062a-67dc-447d-b42d-fd6358df2b69,CSE552,SE,Security Engineering,CSE,"This course is designed to present the students a “host” centric approach to various aspects of computer software security. Broadly, the course would cover: Traditional multi-level security models (Bell La-Padula, Biba etc.), access controls, security in traditional computer programs and attacks against them (buffer/heap overflow attacks), defences against such attacks, writing secure programs (Secure Coding), Viruses/Malware and Trojans, OS level hardening, application and system level security primitives and APIs, cryptographic system primitives and APIs (how to (not) use (and break) them), system level authentication frameworks, introduction to allied topics – IDS, network security etc.",4,CSE231,,,monsoon,TBA,[],,52:14.0,52:14.0,"security-engineering, system-security, threat-modeling, secure-design, authentication, risk-management, software-security"
38d7191a-f393-42cc-8010-adb575581117,CSE538,WN,Wireless Networks,CSE,"This course will cover a variety of mobile systems (wireless LANs, cellular systems, and sensor networks). This course will cover design of various layers in the network stack in the context of wireless communication. This course will cover challenges in mobile systems.",4,CSE232,,5,monsoon,Mukulika Maity,"[{""day"": ""Tuesday"", ""end_time"": ""11:00"", ""start_time"": ""09:30""}, {""day"": ""Thursday"", ""end_time"": ""11:00"", ""start_time"": ""09:30""}]",ECE538,52:14.0,52:14.0,"wireless-networks, mobile-communication, routing-protocols, wireless-protocols, ad-hoc-networks, wifi, spectrum-management"
3a8d289a-1bf5-400e-b25a-a753b5c8245b,CSE528,IBC,Introduction to Blockchain and Cryptocurrency,CSE,"From this course, we will learn about basics of blockchains and cryptocurrency. Topics to be covered include how cryptocurrency such as Bitcoin and Ethereum work, blockchain and other decentralized consensus protocols, digital coin mining, security and privacy of cryptocurrencies, scalability, cryptographic techniques for digital currency, and applications of blockchain to smart contracts, and financial exchanges.",4,CSE546,,,winter,TBA,[],,52:14.0,52:14.0,"blockchain, cryptocurrency, decentralization, consensus-algorithms, smart-contracts, ethereum, distributed-ledgers, bitcoin"
3afccefc-fd91-4dc4-9c39-ea183822522a,SSH225A,CGS,Comprehensive Gender Sensitization,SSH,"This course aims to develop a deepere understanding of key concepts, ideas and issues pertaining to gender. The course focusses on cultivating a better understanding of issues pertaining to gender based discrimination and gendered violence. The course aims to foster a gender sensitive perspective among students.",4,,,,monsoon,TBA,[],,52:19.3,52:19.3,"gender-studies, gender-sensitization, social-equality, gender-justice, lgbtq-awareness, intersectionality, inclusive-education"
3c1a55e4-1374-409b-b99a-854c0818fcd9,ECO324,SSSE,Spatial Statistics and Spatial Econometrics,SSH,"The purpose of this course is to introduce the standard spatial- analytic framework for analyzing spatial data and its target audience are social scientists and engineers. In the past decade or so, much interest has grown in the area due to readily-available spatially-delineated data, particularly when in 2008 the U.S. Geological Survey stopped charging for its high-resolution LANDSAT archive. However, spatial data and spatial relationships necessitate the use of analytic tools beyond the standard statistical methods such as OLS. The role of spatial autocorrelation (also known as multidimensional autocorrelation) in spatial datasets is a focus of this course. In addition, we will ask: how and why does spatial autocorrelation arise; how is it measured and understood; how does it relate to issues of spatial heterogeneity and spatial dependence; and how these factors inform the specification and estimation of regression models. Specific modeling techniques include spatial autocorrelation measures (Moran's I, Geary's C), spatial regression models.",4,ECO221,,4,winter,Gaurav Arora,"[{""day"": ""Tuesday"", ""end_time"": ""18:00"", ""start_time"": ""16:30""}, {""day"": ""Thursday"", ""end_time"": ""18:00"", ""start_time"": ""16:30""}]",ECO524,52:19.3,52:19.3,"spatial-statistics, econometrics, spatial-modeling, geo-spatial-data, spatial-dependence, spatial-regression, geographic-analysis"
3c8f5111-965b-41c7-9783-d1e1128c0137,BIO545,BioStats,Biostatistics,BIO,The main aim of this elective course is to provide students a good background in Quantitative Biology and enabling them to implement various statistical methods in analyzing biological data and its visualization. The course will also provide basic introduction of applied biostatistics.,4,,,6,winter,Gaurav Ahuja,"[{""day"": ""Tuesday"", ""end_time"": ""16:30"", ""start_time"": ""15:00""}, {""day"": ""Thursday"", ""end_time"": ""16:30"", ""start_time"": ""15:00""}]",,52:19.3,52:19.3,"biostatistics, statistical-inference, hypothesis-testing, biomedical-data, survival-analysis, clinical-trials, bio-data-analysis"
3dabfd9c-30a1-4220-abab-33c17b124eda,CSE570,VR,Virtual Reality,CSE,"Advanced areas of VR including telepresence, procedural modelling of large virtual worlds, and designing multi-model interactions and interfaces for VR will also be discussed. This will be a project-based course using game engine based VR development.",4,,,,winter,TBA,[],,52:14.0,52:14.0,"virtual-reality, immersive-tech, 3d-modeling, vr-environments, hci, simulation-design, user-experience-vr, spatial-computing"
3eff2465-7cd3-4e8c-844f-eda615760ebc,BIO531,IMB,Introduction to Mathematical Biology,BIO,The aim of this course is to introduce mathematics as applied in quantitative study of biological systems and biological data analysis. Use of ordinary and partial differential equations (ODEs) will be emphasized in this course. Both exact and numerical solutions will be discussed. We also plan to briefly introduce dynamical systems analysis for ODEs.,4,MTH100,,6,winter,Sriram K.,"[{""day"": ""Monday"", ""end_time"": ""16:30"", ""start_time"": ""15:00""}, {""day"": ""Wednesday"", ""end_time"": ""16:30"", ""start_time"": ""15:00""}]",,52:19.3,52:19.3,"mathematical-biology, population-dynamics, epidemiology-models, bio-simulations, systems-biology, differential-equations-biology"
3fefb7ea-8f2a-4cc9-8fe6-09147909f61a,SSH221,SPP,Social and Political Philosophy,SSH,"This course will introduce students to some of the fundamental debates in contemporary social and political philosophy. It will cover a range of concepts, theories, ideas, and thinkers, and their relevance in current contexts. The course will have two parts. In the first part we will explore the philosophical debates in the Western Political Theory tradition and discuss philosophical positions on Utilitarianism, Equality, Libertarianism, Marxism, Multiculturism, and Feminism. The second part of the course will focus on debates in the Indian political theoretical tradition. This part will engage with debates on religion, freedom, and equality within the Indian context and apply it to important contemporary social and political questions.",4,,,3,monsoon,Manohar Kumar,"[{""day"": ""Monday"", ""end_time"": ""18:00"", ""start_time"": ""16:30""}, {""day"": ""Wednesday"", ""end_time"": ""18:00"", ""start_time"": ""16:30""}]",,52:21.9,52:21.9,"political-philosophy, justice, state-theory, liberalism, democracy, rights, power-structures, normative-ethics, civil-liberties"
40395313-ba69-4c05-a38e-44c4a43d387e,PSY305,ATP,Attention and Perception,SSH,"Attention is one of the major cognitive processes responsible for making us achieve our day-to-day goals. This course-work aims to introduce fundamental principles of how attention helps us to perceive the world around us. Students will be introduced to various experimental paradigms and theories (both classical and contemporary) used to study effects and limitation of attention on human behavior and perception. With the balanced practical sessions and assignments students will develop a fundamental understanding of designing behavioral experiments to study various cognitive processes. For 500 level, students along with the course work will be additionally required to do a project work involving designing a research experiment, collect and analyse the data along with statistical analysis and has to be submitted in the form of project report & presentation. The research project for 500 level could be either replicating classical experiment/ suggested by the student/ suggested by the course instructor.",4,,,6,winter,Sonia Baloni Ray,"[{""day"": ""Tuesday"", ""end_time"": ""12:30"", ""start_time"": ""11:00""}, {""day"": ""Thursday"", ""end_time"": ""12:30"", ""start_time"": ""11:00""}]",PSY505,52:19.3,52:19.3,"cognitive-psychology, attention, perception, visual-processing, neural-mechanisms, human-behavior, sensory-processing"
404d4666-210b-4b64-9667-608ae1489aed,SOC513,ETB,Enhancement Technologies and the Body: Beyond the Human Form,SSH,"This course examines how technological, biomedical and bioengineering interventions in human form make it possible to alter the biological form and function of the human body from an anthropological perspective. It traces how cultural assumptions about the “normal” and “deficient” bodies come to be constructed and how body-altering medical technologies are used to “enhance” human form, which not only repair or replace functions, but may go beyond what is typically considered therapeutic medical intervention. Drawing on anthropological perspectives grounded in feminist theory, socio-materialism, cyborg theory, critical disability studies and trans and post-humanist critiques of the human this course will examine the social, political and ethical consequences of technological bodily innovations and enhancements. Mapping a range of medical interventions—NRTs, Hormones, Prosthetics, Digital Technologies to Wearable Augmentations—this course will equip learners in analyzing the impact these interventions have on understanding of the body, social identity, embodiment, social relations and social institutions.",4,SOC101,,5,monsoon,Paro Mishra,"[{""day"": ""Monday"", ""end_time"": ""12:30"", ""start_time"": ""11:00""}, {""day"": ""Thursday"", ""end_time"": ""12:30"", ""start_time"": ""11:00""}]",,52:19.3,52:19.3,"posthumanism, bioenhancement, wearable-tech, body-augmentation, transhumanism, techno-bodies, human-enhancement, cyborg-studies"
412308d2-993c-45b2-80f5-9c4b119b9186,CSE573,ISy,Interactive Systems,CSE,"With advent of different computing platform, e.g., mobile phones, smart-watches, smart-TVs, VR, Web, we are surrounded by interactive systems and we use them regularly for pleasure, accessing service, or even by compulsion. Despite tremendous progress in technology, many of the current day systems are hard to use for a non-tech savvy population? The course will teach you how to design and develop usable interactive systems. It will also develop skills to analyze and critique existing systems and understand ways by which some of these systems may be violating some of the fundamental usability principles and what can be done to fix it.",4,,,,winter,TBA,[],,52:14.0,52:14.0,"interactive-systems, hci, usability, interface-design, real-time-interaction, input-devices, user-centered-design"
416fbe8d-6a68-43c0-98f7-a6f2d03bcc41,SSH341,GAI,"Governing AI: History, Theory, Policy (New)",SSH,"In conceptualising Artificial Intelligence (Henceforth AI) as a social science category, this course will enable students to analyze the emerging field of AI regulation and governance, help them learn about the regulatory landscape of the AI, and equip them situate the regulatory landscape historically and theoretically. The course is divided in four parts. The first part introduces the central conceptual scheme built around the definitions of AI, and the concepts of regulation and governance. Part two surveys the AI regulateroy landscape globally and equips students analyze them through historical and conceptual devices outlined in the earlier parts.Part three traces the history of the blurring lines between humans and machines in terms of intellectual labour. The final part introduces the relevant literature drawn from political philosophy and theory to contextualise the idea of human political agency and the implications that blurred lines between machines and humans may have on it.",4,,,5,monsoon,Praveen Priyadarshi,"[{""day"": ""Tuesday"", ""end_time"": ""18:00"", ""start_time"": ""16:30""}, {""day"": ""Thursday"", ""end_time"": ""18:00"", ""start_time"": ""16:30""}]",SSH541,52:21.9,52:21.9,"ai-policy, governance-of-ai, ethics-of-ai, regulatory-frameworks, ai-history, algorithmic-accountability, responsible-ai"
