uuid,course_code,course_acronym,course_name,dept_acronym,description,credits,prerequisites,antirequisites,semester,semester_type,professor_allocated,schedule,related_course_codes,created_at,updated_at,suitable tags
be22114a-b176-4574-8211-11aaf407e648,SOC313,SoI,Sociology of India: Themes and Perspectives,SSH,"This course will equip students with an understanding of the foundations, contemporary debates and relevant themes of Sociology and Social Anthropology in India. It seeks to familiarise students with the discipline as a pre-requirement to doing research in Sociology/Social Anthropology. With this main objective in mind, the course is broadly divided in two parts: the first part engages with the debatessurrounding, theory, approaches, methods, contextualisation, refexivity and so on in Sociology. The second part, introduces key themes in Sociology and Social Anthropology. By the end of the course, the students will be able to develop agrounding in Sociology and use it to envision their own research.",4,,,6,winter,Smriti Singh,"[{""day"": ""Tuesday"", ""end_time"": ""11:00"", ""start_time"": ""09:30""}, {""day"": ""Friday"", ""end_time"": ""11:00"", ""start_time"": ""09:30""}]",SOC503,52:21.9,52:21.9,"indian-society, caste-system, rural-urban-structures, religion-and-politics, social-stratification"
beda1ee9-6e8e-44b1-98c8-15afd4197a4a,MTH514,COT,Coding Theory,MTH,This course deals with the design and study of error-detecting and error-correcting codes for the reliable transmission/storage of data over noisy communication channels.,4,"MTH211,MTH212",,,winter,TBA,[],,52:16.5,52:16.5,"error-correcting-codes, information-theory, hamming-codes, cyclic-codes, applications-in-communication"
bf1d6b58-2d0b-4785-a453-09ffe6e2a6bc,BIO101,FOB,Foundations of Biology,BIO,"The objective of this course is to provide an introduction to the foundations of biology including the chemistry of life, cellular mechanisms, genetics and mechanisms of evolution.",4,,,2,winter,Jaspreet Kaur Dhanjal,"[{""day"": ""Monday"", ""end_time"": ""12:30"", ""start_time"": ""11:00""}, {""day"": ""Wednesday"", ""end_time"": ""12:30"", ""start_time"": ""11:00""},{""day"": ""Friday"", ""end_time"": ""12:30"", ""start_time"": ""11:00""}]",,52:19.3,52:19.3,"cell-biology, genetics, molecular-biology, evolutionary-theory, biological-systems, introductory-biology"
bf7b6656-a74e-4b69-83d9-979032c1abe5,ECE331,AFW,Applied Fields and Waves,ECE,"This course expands the basic understanding of fields and waves to its applied level. It will discuss the common high-frequency techniques for devices, circuits and systems. It introduces the concept of boundary conditions, different current sources and radiation concept. It then provides basic understanding of microwave network analysis techniques required for high-frequency circuit analysis. The course also includes few live demonstrations of characterizing radiating and guiding components using simulation tools and/or measurements.",4,ECE230,,6,winter,Debidas Kundu,"[{""day"": ""Tuesday"", ""end_time"": ""12:30"", ""start_time"": ""11:00""}, {""day"": ""Thursday"", ""end_time"": ""12:30"", ""start_time"": ""11:00""}]",ECE531,52:16.5,52:16.5,"electromagnetics, maxwell-equations, wave-propagation, transmission-lines, field-theory, applied-physics"
c00a395b-c0ea-4dec-877e-9ea4cef387d9,MTH501,L&AI,Logic and Artificial Intelligence,MTH,"It is well known that the field of Artificial Intelligence (AI) has roots in logic (philosophical and mathematical). In fact, many of the most influential figures in AI’s early days had planned to use ideas from philosophical logic to formalize commonsense reasoning or reasoning by a rational agent. In turn, applications in AI has led to numerous fascinating new logical systems. The goal of this course is to study the logical frameworks that can be used to model reasoning by and about rational agents. This would require us to consider many different aspects, such as, action, knowledge, belief, and revision. The course will attempt to cover formal approaches to these with the goal of formalizing systems where these things work together. What this course is: This is a course on formal logic. The material is theoretical. What this course is not: This is not a computer science or course or a course in AI. There are no algorithms discussed or coding involved.",4,"CSE121, MTH210",,5,monsoon,Sankha Basu,"[{""day"": ""Tuesday"", ""end_time"": ""11:00"", ""start_time"": ""09:30""}, {""day"": ""Thursday"", ""end_time"": ""11:00"", ""start_time"": ""09:30""}]",,52:16.5,52:16.5,"symbolic-logic, automated-reasoning, formal-logic, AI-foundations, logic-inference, computational-logic"
c1e59521-2744-4393-b564-4ee285716863,ECE554,CS,Compressive Sensing,ECE,This is a senior UG / PG level course on Compressed Sensing. Compressed Sensing (CS) is most talked about topic in signal processing today and is taught in all the top universities across the world. CS is the study of under-determined linear inverse problems where the solution is typically a lower dimensional many fold embedded in a higher dimensional space. The most prominent examples being - a sparse solution or a low-rank solution. Today compressed sensing permeates not only signal processing and applied maths but also encompasses a variety of topics in machine learning and computer vision. This course is open to both CS and ECE students.,4,MTH100,,,monsoon,TBA,[],,52:16.5,52:16.5,"sparse-representation, signal-recovery, under-sampled-data, optimization, compressive-algorithms, reconstruction"
c228f936-7da1-4ae7-9e07-c7b6ace1fa71,BIO541,DSG,Data Sciences for Genomics,BIO,"The field of Genomics is expanding its horizon with help of high throughput technologies. Scientist are trying to answer fundamental questions related to health, society and human survival outside earth using genomics. With such increase of applications, it constantly needs computational experts for systematic analysis of data and acheiving meaning full insights. Infact the computational experts have now started taking lead in genomic projects. Hence this course is meant to guide students for data analysis approach and steps involved in computational genomics and make them familiar with latest development in genomics.",4,,,6,winter,Vibhor Kumar,"[{""day"": ""Tuesday"", ""end_time"": ""11:00"", ""start_time"": ""09:30""}, {""day"": ""Friday"", ""end_time"": ""11:00"", ""start_time"": ""09:30""}]",,52:19.3,52:19.3,"genomics-data-analysis, high-throughput-data, sequencing-algorithms, bioinformatics, statistical-genomics"
c26f046b-0583-45ce-9f7e-7be73fc39d5d,CSE749,NAP,Network Anonymity and Privacy,CSE,"Historical network anonymity and privacy protocols – MIXes and MIXnets, various theoretical and practical attack strategies against high and low-latency anonymity networks, practical traffic analysis against modern anonymity systems like Tor, Freenet, GNUnet, JAP, defenses against traffic analysis attacks, performance vs anonymity trade-offs, side-channel attacks, covert channel communications, pseudonymity and privacy, Anonymous P2P communication systems (e.g. Oneswarm), traffic analysis against anonymous VoIP communications, Internet censorship and censorship resistance tools and strategies, large-scale Internet surveillance and anti-surveillance, decoy routing.",4,,,,monsoon,TBA,[],,52:14.0,52:14.0,"anonymous-communication, onion-routing, traffic-analysis, internet-privacy, secure-networking, privacy-protocols"
c294e8fd-b610-4847-9e77-09754a2526c9,CSE694F,MS,Multimedia Security,CSE,"Media Security course introduces the multimedia fundamentals and security related issues such as rights protection, authentication, traitor tracing, forensics, adversarial signal processing, covert communication and surveillance. Overview of different aspects of multimedia security and compression techniques, architectures and standards will be discussed. Some of the course topics are information hiding and its applications, media compression, robustness analysis, encryption, passive forensics, source identification, multimedia signatures and egocentric video forensics, adversarial signal processing, Discrete Fourier/Wavelet Transform, electrical network frequency estimation, visual surveillance, steganography and steganalysis.",4,ECE350,,,winter,TBA,[],ECE651,52:14.0,52:14.0,"watermarking, steganography, DRM, video-authentication, content-protection, media-encryption"
c49aae0d-0a2b-4ff4-8855-5a48a4263f80,MTH564A,IRG,Introduction to Riemannian Geometry with Some Applications,MTH,"This course aims to equip students with some of the necessary mathematical tools needed to pursue further studies in these emerging fields. We will begin the course with some preliminaries. We will cover some very basic topology, just enough to be able to define a manifold. We will also spend some time on differentiable manifolds, tangent spaces, and vector fields, before we introduce the concept of a Riemannian metric.",4,"MTH100,MTH203",,,monsoon,TBA,[],,52:16.5,52:16.5,"differential-geometry, curvature, manifolds, riemannian-metrics, geometric-analysis, theoretical-math"
c4b16cda-b55e-482b-b9d2-85b8b9b74f35,CSE516,TDL,Theories of Deep Learning,CSE,"Deep Learning (under the broader umbrella of Machine Learning) nowadays is a popular approach that allows computers to learn attributes from data. The aim is to enhance our understanding in terms of a hierarchy of concepts, where each such concept comprises of simpler ones. Alongside the proliferating application of these techniques for image, audio or time-series data, practitioners have developed a good understanding of the properties that make these deep nets effective. There are now a number of theories being developed to give a more formal mathematical understanding to accompany these observations; this course will explore some of these varying perspectives.",4,"MTH100,MTH203, CSE343, CSE543, ECE563, CSE342, CSE542",,5,monsoon,Vinayak Abrol,"[{""day"": ""Tuesday"", ""end_time"": ""11:00"", ""start_time"": ""09:30""}, {""day"": ""Thursday"", ""end_time"": ""11:00"", ""start_time"": ""09:30""}]",ECE559,52:14.0,52:14.0,"neural-network-theory, generalization-bounds, representation-learning, optimization-landscapes, deep-learning-theory"
c6c1025a-11d1-4fb2-912e-9a4aee22d085,BIO506,SSSBB,Stochastic Simulations in Systems Biology and Biophysics,BIO,The aim of this course is to introduce mathematics as applied in quantitative study of biological systems and biological data analysis. Use of ordinary and partial differential equations (ODEs) will be emphasized in this course. Both exact and numerical solutions will be discussed. We also plan to briefly introduce dynamical systems analysis for ODEs.,4,BIO531,,,monsoon,TBA,[],,52:19.3,52:19.3,"monte-carlo-simulation, biochemical-networks, stochastic-modeling, molecular-dynamics, systems-biology"
c6d61e9b-23be-446d-9b3e-2146e1caba5b,MTH204,M-IV,Mathematics IV,MTH,"This is the first course in differential equations (ordinary and partial) to be taken by students in their second year of undergraduate studies. The primary focus of the course will be on learning how to solve linear second order ODEs (homogeneous as well as non-homogeneous) and PDEs (wave, heat and Laplace) using different methods. The course will also extend to systems of linear ordinary differential equations including a discussion on qualitative methods for nonlinear systems.",4,MTH203,,4,winter,Sarthok Sirkar / Subhashree Mohapatra,"[{""day"": ""Tuesday"", ""end_time"": ""12:30"", ""start_time"": ""11:00""}, {""day"": ""Thursday"", ""end_time"": ""12:30"", ""start_time"": ""11:00""}]",,52:16.5,52:16.5,"vector-calculus, ODEs, PDEs, complex-variables, mathematical-methods, applied-math"
c712150e-0abf-461a-9426-a77fce6f4771,ENT301,FOM,Foundations of Marketing,SSH,"Why do we need to study about Marketing? In other words, does Marketing as a discipline really needs to be formally studied? In fact, as a discipline where does Marketing really stand at. Much like any social science discipline Marketing and its history remains evolutionary in nature. Even as sit down to write about the discipline there are changes that are happening inherently. However, much of the course and the history of it comes from Economics and the rules of it. Markets, Demand & Supply, Pricing, Competition and some more have their origins in both Economics and later Marketing also enveloped some of it. In the 80’s when the markets started opening up the new world of organised retailing and as RFID started seeping into retailing the whole texture of Marketing started to change. Consumer Behavior as a discipline emerged much more strongly and proactively, Marketing became more subjective in nature and less prone to assumptions. Simultaneously it was not only about demand generation and fulfilment. Context like impulse buying, shopping history and data driven marketing started doing the rounds. And as Digital started putting its footprint in the mid 2000’s the whole gamut of Marketing underwent massive changes.",4,,,4,winter,Nalin Jain,"[{""day"": ""Monday"", ""end_time"": ""12:30"", ""start_time"": ""11:00""}, {""day"": ""Wednesday"", ""end_time"": ""12:30"", ""start_time"": ""11:00""}]",,52:19.3,52:19.3,"marketing-strategy, consumer-behavior, segmentation-targeting, brand-management, digital-marketing, business-fundamentals"
c72c7322-387a-4101-953a-da1d1bc51424,SSH216,IIM,Introduction to Indian Mythology,SSH,"The primary aim of this course is to introduce students to vast, deep and rich world of Indian mythology. The course will seek to build a generic understanding of the Indian system of thought, with focus on stories as means of unravelling truth and building perspective.",2,,HSS219,5,monsoon,TBA,[],,52:21.9,52:21.9,"hindu-mythology, cultural-heritage, epics-ramayana-mahabharata, religious-narratives, socio-political-myths"
c7b25d7c-af10-447a-939a-b1500e342192,CSE561,PGM,Probabilistic Graphical Models,CSE,This course will introduce the basic concepts of probabilistic graphical models. Graphical Models are a unified framework that allow to express and manipulate complex probability distributions in a compact and efficient way. They allow to one to reach mathematically sound conclusions in presence of limited and noisy observations. Many machine learning applications are tackled by the use of these models,4,MTH201,,,winter,TBA,[],,52:14.0,52:14.0,"PGM, bayesian-networks, markov-random-fields, latent-variable-models, probabilistic-inference, graphical-representations"
c8d36a4f-2282-4570-a640-88f020678446,MTH270,NM,Numerical Methods,MTH,"This is a first course on Numerical Methods to be offered to 2nd / 3rd year undergraduate students. It covers basic topics in root finding, interpolation, numerical differentiation and integration and then moves to methods to numerically solve linear systems of equations as well as ordinary and partial differential equations. The theory involved in deriving methods as well as their error and stability properties is given due attention alongside an insistence on applying the methods, writing computer programs, obtaining numerical solutions and comparing them with analytical solutions whenever possible.",4,"MTH100,MTH204",,,monsoon,TBA,[],,52:16.5,52:16.5,"root-finding, interpolation, numerical-integration, linear-systems-solving, error-analysis, applied-numerics"
c8d4665e-6954-4be5-9231-d60794e28618,SOC213,IDE,Introduction to Digital Ethnography,SSH,"Course Description: This course is intended to be an introductory course and will systematically introduce learners to the basics of digital ethnography. By exposing learners to the fundamentals of Ethnography as a research method, it will help facilitate its application to the online virtual space. The course will use a combination of lectures and case studies to showcase how Digital Ethnography was used to discover significant nuggets of information that was then used to uncover larger trends.",4,,,2,winter,Soibam Haripriya,"[{""day"": ""Tuesday"", ""end_time"": ""18:00"", ""start_time"": ""16:30""}, {""day"": ""Thursday"", ""end_time"": ""18:00"", ""start_time"": ""16:30""}]",,52:19.3,52:19.3,"online-culture, digital-research-methods, social-media-analysis, virtual-fieldwork, ethnographic-approach"
c8d47810-bf2d-45d0-8ac9-1c78bf1225a2,ECE510,DHD,Digital Hardware Design,ECE,Field programmable gate arrays (FPGAs) are the first choice for implementation of digital systems due to their distributed and parallel architecture. FPGAs also allows complete control over arithmetic,4,ECE270,,,monsoon,TBA,[],,52:16.5,52:16.5,"RTL-design, datapath-control, finite-state-machines, digital-architecture, Verilog-VHDL, logic-synthesis"
c8dd679d-18a6-4421-a1de-31aedd05a5ce,CSE564,RL,Reinforcement Learning,CSE,"The course will introduce reinforcement learning. We will consider exact versions of value and policy iteration, followed by approximations based on gradient methods, temporal difference based methods, and last but not least, simulation based methods like Q-learning.",4,MTH201,,,monsoon,TBA,[],ECE564,52:14.0,52:14.0,"agent-learning, reward-optimization, markov-decision-processes, Q-learning, temporal-difference, RL-algorithms"
c911f2d3-bfac-4f6c-aee8-b36408a1d9da,ECE670,Irob,Robotics,ECE,"This course will provide a comprehensive knowledge in robotics from theory to implementation. The course will cover fundamental concepts related to mathematical modelling, path planning and control of various robotic systems including robot manipulators, ground robots and drones. We will use several software platforms like Simulink, Matlab Robotics Toolbox, ROS and Gezebo for simulations and projects. Further hardware demos will be shown using Qbot 2e (ground robot), 3dr solo (drone) and rotary inverted pendulum (robot arm) available in control lab.",4,,,5,monsoon,Sayan Basu Roy,"[{""day"": ""Tuesday"", ""end_time"": ""18:00"", ""start_time"": ""16:30""}, {""day"": ""Thursday"", ""end_time"": ""18:00"", ""start_time"": ""16:30""}]",CSE633,52:14.0,52:14.0,"robot-kinematics, motion-planning, sensors-actuators, control-systems, mobile-robots, autonomous-systems"
c91f16a2-e601-4f7f-9e04-c456c10476df,CSE523,RA,Randomized Algorithms,CSE,"Randomisation and probability plays a huge role in today’s algorithms, especially in two situations: the data itself has errors, or is too large and complex. This course studies algorithms which, by design, may not be correct 100% of the time, or run within the stipulated resource always, but definitely do so in an overwhelmingly large number of cases. The course will be split into three main logical sections - tools from probability theory, algorithms which are probabilistic and analysis of deterministic algorithms for different input distributions.",4,"CSE222,CSE121,MTH201",,6,winter,Rajiv Raman,"[{""day"": ""Monday"", ""end_time"": ""12:30"", ""start_time"": ""11:00""}, {""day"": ""Wednesday"", ""end_time"": ""12:30"", ""start_time"": ""11:00""}]",,52:14.0,52:14.0,"randomization-techniques, algorithm-efficiency, probability-in-algorithms, expected-runtime, hashing-applications"
c9876a2f-f9ff-4ecf-8c61-311659a77ec9,DES524,EFD,Ergonomics/Human factors for Design,DES,"In designing, ergonomics takes care of the users' need, their limitations and abilities. Various aspects of basic anthropometry, physical, physiological, psychological and biomechanical limitations and abilities of the human body with reference to human centred design of products and systems will be explained. Students will: a) learn the principles, overview and background of ergonomics; b) develop the skill to identify the user friendly man machine environment system; and c) understand the methods and processes to evaluate the products, facilities, environment, jobs and tasks. This course will help in finding real time solutions to improve the quality of life and performance of an individual.",4,,,,monsoon,TBA,[],,52:19.3,52:19.3,"human-centered-design, anthropometry, user-safety, usability-engineering, physical-interaction, design-psychology"
ca16bac0-9c60-481a-8552-165174b9bc08,CSE582,SPEM,Software Production Evolution and Maintenance,CSE,"Most of the software products developed today are a collection of closely coupled software applications that fulfills multiple user needs at once. Software product line paradigm is a useful approach while developing multiple software products that share common functional and quality requirements. It facilitates efficient development, production, and mass customization of software-intensive systems and software products by using a set of software subsystems and interfaces that form a common structure. However, the development and the delivery of software product is only a part of the story. Software teams should work hard to continuously improve the software applications based on the changing requirements as well as preserve them from failure of decline. While the former is called software evolution, the latter is called software maintenance. This course will guide students to develop and maintain large scale software products by providing theoretical and practical aspects of software product line paradigm as well as software evolution and maintenance.",4,,,,monsoon,TBA,[],,52:14.0,52:14.0,"code-maintenance, legacy-systems, software-evolution, software-refactoring, devops, version-control"
cb49589d-44eb-4795-b7c4-eccfb4e8e345,CSE663A,MEL,Meta-Learning,CSE,"Meta-Learning' or 'learning to learn' refers to the problem of developing machine learning/deep learning models that can adapt to new tasks/domains/environments, either very ""rapidly"", i.e., requiring very little new data/experience, or in a manner robust to distributional shifts, such as when users change their behaviour, as has been experienced across the board due to the pandemic. Both scenarios are also closely related, since distributional shifts also imply the relative scarcity of 'new' data, with practical considerations making it imperative to rapidly adapt to every 'new normal'. Meta-learning is also closely related to two long-desired goals of Al in general, viz., continual learning (without forgetting) and learning higher-level (and ideally causal) representations that allow for better generalisation, e.g. to deal with non-stationarity or for longer duration forecasting etc. In the light of the above context, the course will aim to (i) cover the basic techniques for meta-learning (ii) outline and model selected industry applications in a meta-learning setting and (iii) highlight the connections with closely related long-term Al-research goals.",4,"CSE643,CSE641, CSE343, CSE543, ECE563",,,winter,TBA,[],,52:14.0,52:14.0,"learning-to-learn, few-shot-learning, adaptive-models, transfer-learning, hyperparameter-optimization"
cbcfbe5b-bcbd-403e-9e2a-67b9be279323,MGT311,EIITM,Emerging Issues in IT Management,SSH,"The objective of course of EIITM covering emerging issues in IT management such as IT Governance, Risk Management, Infrastructure management , Data Privacy, Data Security, Computer Ethics and Sustainability is to appraise students of larger impact of IT from management point of view.. Students will be able to leverage their information technology background to appreciate far reaching consequences of technology so as to address them and make this technology safe , secure and without ill effects. The knowledge gained through this course will bring specialized value proposition for prospective employers. This course will have series of rigorous practice assignments and projects from real industry business cases and will involve extensive hands on exercises dealing with real data, developing tools in labs that can and generating insights from several what-if scenario analysis. Classroom sessions will include course book coverage, discussion of real business case studies and practical assessments.",4,,,,winter,TBA,[],,52:19.3,52:19.3,"IT-governance, digital-ethics, data-regulation, emerging-tech-strategy, IT-risk-management, tech-policy"
cbe42cdb-40ca-48d8-bff1-4f1446504c50,ECO312,IO,Industrial Organization,SSH,"This course will introduce basic theoretical models of IO. It will implement applied microenomic theory and game theory to understand how firms take decisions in various settings. The models include profir maximization when there is market power, advertising, heterogeneity in quality, vertical control, models of entry, accomodation and exit, and many others. The course helps one understand how to set up an objective function for a firm facing different challenges in a complex market structure. It will aid the student in understanding real world scenarios. Finally there will also be a short section on some empirical methods used in IO. IO has grown into one of the fundamental fields within economics, and is essential in order to gain a broader understanding of the subject.",4,"ECO101,ECO311",,,winter,TBA,[],ECO512,52:19.3,52:19.3,"market-structure, firm-strategy, oligopoly-theory, competition-policy, pricing-models, game-theory-in-economics"
