uuid,course_code,course_acronym,course_name,dept_acronym,description,credits,prerequisites,antirequisites,semester,semester_type,professor_allocated,schedule,related_course_codes,created_at,updated_at,suitable tags
0133f0e6-d941-4c83-82ee-7b615a33edb0,COM301A,TCOM,Technical Communication,OTHERS,"Technical Writing is a two-credit, practice-oriented course that provides a complete process for planning, writing, and editing technical documents, with a greater focus on critical thinking and structuring. Students will explore the principles of effective written communication and critical reading, examine a variety of professional writing samples to gain an understanding of the skills needed to successfully communicate through professionally written e-mails, scientific reports, proposals and reviews. They will also learn the techniques of objective reporting on scientific and technical material; strategies of reading and writing research papers; drafting research abstracts, creating research pitch, techniques of poster designing, and making presentations. Additionally, this course will also teach students to draft their resumes, academic cover letters, statement of purpose, make editorial changes, usage of resources for literature survey, plagiarism, and the specific use of style sheets.",4,,,5,monsoon,Payal C Mukherjee,"[{""day"": ""Wednesday"", ""end_time"": ""14:00"", ""start_time"": ""12:30""}]",,52:21.9,52:21.9,"technical-writing, research-writing, scientific-communication, academic-presentations, critical-reading, professional-documents, resume-writing, plagiarism-awareness, literature-review, citation-skills, peer-feedback"
01ce13a5-1d5b-4115-99f5-6d57d7166ee0,MTH518,TNT,Topics in Number Theory,MTH,"The aim of this course is to introduce various topics in Number Theory such as Farey fractions, continued fractions, partitions, quadratic forms and geometry of numbers.",4,MTH211,,,monsoon,TBA,[],,52:16.5,52:16.5,"number-theory, continued-fractions, modular-arithmetic, quadratic-forms, partitions, primes, factorization, integer-sequences, pure-mathematics, theorem-proofing, diophantine-equations"
028d2f70-dcc1-4b33-91a7-7d08f60e1471,SOC307,DSR,Digital Social Research,SSH,"With the digital social data growing at an accelerated pace on an everyday basis, there is an urgent need for social researchers to decrypt, examine and interpret this unusually large-scale complex data fill. Doing this systemically will not only help in deciphering and understanding the social world we live in but will also help strategically combat the complex challenges of the contemporary social world. With a growing demand for such skills both in the academic and the commercial sectors, this course anchored in sociology and anthropology will provide the learners to a methodological rigour steeped in theoretical underpinnings from both these fields. Through empirical approaches suited specifically for the digital data, this course will provide the learners an opportunity to effectively engage not only in identifying interesting issues to study, but also with framing valid research questions, formulating an effective research design, sampling, data collection methods and tools, quantitative/qualitative and mixed methods analyses of the collected data and the necessary theoretical interpretation of the results. The course also aims to provide its learners an objective view of social data issues viz. reliability, replicability, reproducibility, validity and generalizability of the data and the associated methods. It will also introduce the learners to ethical implications associated with conducting digital social research.",4,,,,monsoon,TBA,[],,52:19.3,52:19.3,"digital-research, data-collection, research-methods, mixed-methods, online-surveys, social-data, web-scraping, digital-ethics, reproducibility, coding-qualitative-data, computational-social-science"
0516cf3f-96d4-48a1-a725-a346f18398ae,SOC216,PASSP,"Political Anthropology: State, Subject, Power",SSH,"To do well in this course requires a lot of reading and intellectual application. This is a hard 2xx level class. This course is an examination of politics as an activity constitutive of humanness. The course introduces students to foundational problems in political anthropology. Order, sovereignty and contestation, government, State and subject are key categories we will examine. Our first question: can there be order in the absence of a government, state, leader, sovereign? We then examine order in the context of empire and kingship, with case studies from Asia and Europe. Next, we trace the emergence of 'government' as a (modern) project of order in the political history of Europe. We look at how systems of political order are transformed during the period of Colonial rule/governance. We will then see the centrality of bureaucracy to modern governance. The second half of the course opens with inquiries into the central political forms of modern history is the 'nation' and the constitution. If constitution is one side, insurrection is its other side and we examine how both are constitutive of 'democracy'. Taking violence as an analytical object, we study the state (and its apparatuses of subjection) at the margins, treading at the limits of legality. Finally, we conclude with a discussion of the political, that is, politics as the distinction between friend and enemy. Another way to look at this course: a survey of forms of power, and the forms of subjection produced in persons subject to power. By the end of the course, students will be able to come up with a nuanced, reasoned analyses of complex problems of politics, drawing on conceptual models developed in this class.",4,,,3,monsoon,Deepak Prince,"[{""day"": ""Monday"", ""end_time"": ""18:00"", ""start_time"": ""16:30""}, {""day"": ""Wednesday"", ""end_time"": ""18:00"", ""start_time"": ""16:30""}]",,52:21.9,52:21.9,"political-anthropology, state-power, bureaucracy, sovereignty, subjectivity, colonialism, democracy, resistance-movements, power-relations, ethnographic-analysis, governance-theory"
05e75dff-0236-4fea-a3ee-4e6eec3033dd,CSE660,TAIS,Trustworthy AI systems,CSE,"Study the need for Trustworthiness of AI systems, and get an understanding of the role of various aspects such as fairness, bias, robustness, explainability, transparency, and ethical aspects of AI systems to create a Trustworthy AI system. Some of the algorithms to mitigate bias and algorithms on explainability of ML systems will also be studied.",4,"CSE643, CSE343, CSE543, ECE563, CSE342, CSE542",,,winter,TBA,[],,52:14.0,52:14.0,"trustworthy-ai, algorithmic-fairness, ethical-ai, bias-mitigation, adversarial-robustness, explainable-ai, privacy-in-ai, security-in-ml, interpretability, risk-analysis, compliance-standards"
06196b8f-3d50-480f-9208-6ca560fa8c4a,ECE240,PCS,Principles of Communication Systems,ECE,"The course is intended to be a broad introduction to Communication Systems. The course will develop understanding of the principles underlying communication systems, describe basic methods for communication and develop requisite mathematical background required for noise analysis of communication systems. The lectures will be supplemented by PyLab simulation exercises, a final term paper/project.",4,"ECE250,MTH201",,4,winter,Ranjitha Prasad,"[{""day"": ""Tuesday"", ""end_time"": ""11:00"", ""start_time"": ""09:30""}, {""day"": ""Friday"", ""end_time"": ""11:00"", ""start_time"": ""09:30""}]",,52:16.5,52:16.5,"communication-systems, analog-modulation, digital-modulation, bandwidth-efficiency, signal-processing, information-theory, noise-models, modulation-techniques, time-frequency-analysis, lab-simulation"
0687819e-8757-4c84-ae9a-2c054fee2cba,ECE564A,MLWCN D,Machine Learning in Wireless Communication and Networks,ECE,"This course will help students understand the applicability of machine learning and deep learning in wireless systems and networks. The course will start with an introduction to some of the fundamental concepts of machine learning as well as wireless communication. Then the students will be introduced with various important and interesting aspects of wireless networks, e.g., localization, spectrum sharing, mmWave communication, etc.. For each of these broad categories student will learn about case studies and applications where machine learning can be leveraged. Most of the course will be based on reading and discussing research papers. Assignments and project will be code implementation heavy.",4,ECE240,,,monsoon,TBA,[],,52:16.5,52:16.5,"machine-learning, wireless-communication, spectrum-management, channel-estimation, localization, reinforcement-learning, signal-prediction, applied-ml, radio-networks, 5G-optimization, network-intelligence"
06bdc610-5894-4695-b126-1e8a537cd0e7,ECE636,COMN,Communication Networks,ECE,"The course introduces the student to analytical tools that help analyze a communications network. We will learn to apply simple queueing models to analyze the delay, throughput, and timeliness performance of networks. We will analyze randomized multiaccess and scheduling. We will study and compare congestion control algorithms for optimizing the utilities like throughput and age of information over an end-to-end path.",4,MTH201,,,winter,TBA,[],CSE636,52:14.0,52:14.0,"computer-networks, congestion-control, queuing-theory, tcp-ip, routing-algorithms, performance-analysis, latency, throughput, packet-scheduling, network-topologies, network-simulation"
071d86d9-53b0-441a-a9c6-069b6726de1d,ECE314,DVD,Digital VLSI Design,ECE,"This course introduces students to CMOS circuits, develops first-order current-voltage and capacitance-voltage models for transistors, transfer characteristics of CMOS inverter, performance estimation for circuits through logical effort, interconnects, combinational circuit design, circuit families, sequential circuit design including clocking and latching techniques, design of datapath subsystems (adders, shifters, multipliers etc.), design of memory subsystems. A course project using state-of-the-art computer aided design (CAD) tools in VLSI gives students hands-on exposer to the most current technology/process.",4,,,5,monsoon,Anuj Grover,"[{""day"": ""Monday"", ""end_time"": ""16:30"", ""start_time"": ""15:00""}, {""day"": ""Wednesday"", ""end_time"": ""16:30"", ""start_time"": ""15:00""}]",ECE514,52:16.5,52:16.5,"vlsi-design, cmos-circuits, logic-synthesis, combinational-circuits, sequential-circuits, layout-design, spice-simulation, transistor-scaling, standard-cells, power-optimization, timing-analysis"
0842800c-3965-4c5e-990a-06cdce5f4879,CSE559,MLN,Mining Large Networks,CSE,"Networks are a fundamental tool for modeling complex social, technological, and biological systems. Coupled with the emergence of online social networks and large-scale data availability in social sciences, this course focuses on the analysis of massive networks which provide many computational, algorithmic, and modeling challenges. The course will cover recent research on the structure and analysis of such large networks and on models and algorithms that abstract their basic properties. We will explore how to practically analyze large-scale network data and how to reason about it through models for network structure and evolution. Topics covered in this course how information spreads through society; robustness and fragility of networks; algorithms for the World Wide Web; prediction and recommendation in online social networks; representation learning for large networks; etc.",4,"CSE222,CSE101,MTH201",,,winter,TBA,[],,52:14.0,52:14.0,"network-mining, graph-algorithms, social-networks, community-detection, graph-clustering, large-scale-data, diffusion-models, recommendation-systems, centrality-measures, network-visualization"
09b209b8-c91f-4549-97a9-7b2f753541fd,SOC204,SNM,Sociology of New Media,SSH,"This course is aimed introducing students to macro-sociological concepts to understand the role of new media and online networking in the contemporary world. (In PART I) we draw from sociological perspectives that move beyond ‘technological determinism’ and shed light on the social and real-world implications of IT-driven media and communications. We begin with a survey of key concepts, including the theories of networks by Barry Wellman (2012), Manuel Castells (1996) and others who conceptualised the rise of ‘new’ media and online communicationsas as central to ongoing social change. (In Part II) We consider a series of thematic areas and evaluate these theories in the context of contemporary socieities. These themes range from the rising inequality and digital divide, to the role of new media in politics and power and also in the related fields of journalism and law. In terms of pedagogical approach, and evaluating criteria, our course will rely on active learning that requires all students to participate and engage with online communities as well as reflect on the key concepts through their own experience as social media users in India.",4,,,,monsoon,TBA,[],,52:19.3,52:19.3,"new-media, media-theory, digital-identity, online-behavior, participatory-culture, social-platforms, algorithmic-curation, media-politics, cyberculture, network-society, internet-sociology"
0a10f7a4-3882-4945-a623-77874a1ac7e3,MTH548,ATPD,Advance Topics in Partial Differential Equations,MTH,"This course is designed for senior undergraduate and Ph.D. students to explore advanced theoretical concepts in Partial Differential Equations (PDEs), focusing on non-linear PDEs, variational methods, regularity theory, and applications in physics and geometry.",4,,,6,winter,Ashish Kumar Pandey,"[{""day"": ""Monday"", ""end_time"": ""16:30"", ""start_time"": ""15:00""}, {""day"": ""Wednesday"", ""end_time"": ""16:30"", ""start_time"": ""15:00""}]",,52:16.5,52:16.5,"partial-differential-equations, boundary-value-problems, finite-difference-methods, elliptic-equations, wave-equations, numerical-methods, functional-analysis, green-functions, applied-mathematics"
0a3a50e9-2af5-447a-a48e-ed076a5f16f3,SSH526,RHPS,Reading Hegel's Phenomenology of Spiri,SSH,"This course will undertake a reading of major sections of one of the foundational texts of the phenomenological tradition within Continental philosophy —the Phenomenology of Spirit, by G.W. F. Hegel. Our concern would be to understand the senses in which the text develops, and/or fails to develop Kant’s transcendental idealist turn. Hegel claims that the movement from Kant, through Fichte and Schelling, to himself, represents a necessary development that ‘completes’ Kant’s transcendental turn, and therefore, sets up a coherent, universal, reflective, and thus, non-sceptical idealism. While this Hegelian (self) interpretation is widely accepted, it is open to contention.",4,,,,monsoon,TBA,[],SSH726,52:19.3,52:19.3,"hegelian-philosophy, phenomenology, german-idealism, dialectics, self-consciousness, master-slave-dialectic, philosophy-of-history, critical-theory, political-philosophy, abstract-thinking"
0ad7d449-1654-4d46-b47a-2df24248b621,ENT413,EF,Entrepreneurial Finance,OTHERS,"Entrepreneurial activity has been a potent source of innovation and job generation in the global economy. The life of an entrepreneur is exciting and dynamic. The challenge of envisioning a new product or service, infecting others with entrepreneurial zeal, and bringing a product to market can be one of the great learning experiences in life. All ventures require financing - taking investors' money today and expecting to return a significantly larger amount in the future. Typically the return comes from the venture's public offering, sale or merger. In the interim, the venture must manage its financial resources, communicate effectively with investors and partners and create value. This course is designed to provide the student with the ability to analyse the various processes and sources of seed and venture capital for funding a new enterprise – debt and equity. Planning for the funding aspect of a new venture is critical and this course will address the alternative sources of funds for carrying out the mission of the venture. Entrepreneurial Finance is primarily designed for students who plan to get involved with a new venture at some point in their career -- as a founder, early employee, advisor or investor. However, the course is also appropriate for students interested in gaining a broader view of the financing landscape for young firms.",4,,ECO331,6,winter,Anupam Saronwala,"[{""day"": ""Tuesday"", ""end_time"": ""12:30"", ""start_time"": ""11:00""}, {""day"": ""Thursday"", ""end_time"": ""12:30"", ""start_time"": ""11:00""}]",,52:21.9,52:21.9,"entrepreneurship, venture-capital, startup-valuation, angel-investing, business-finance, financial-statements, term-sheets, revenue-models, investment-decisions, fundraising-strategy, pitch-deck"
0b145f61-26bb-4e82-828d-81b00d364d14,SSH222,TPEE,Theory and Practice of Engineering Ethics,SSH,"The course aims at orienting the students to the theory and practice of meta-ethics, using a multidisciplinary and cross cultural approach.The goal is to help engineering and IT professionals think of ethics as part of the very process of their work.The course does not provide solutions to critical dilemmas. It does not claim to create ‘moral’ people, or ethical engineers.Rather, it encourages critical thinking about ethical issues and decision making. Students will learn to apply meta ethical theories to IT scenarios.We will use a mixed instructional methodology, that includes lecture, discussion, Q&A, one-on-one dialogue, learning team activities, handouts, library reference materials, ppt slides and video clips.",4,,,6,winter,TBA,[],,52:21.9,52:21.9,"engineering-ethics, ethical-frameworks, case-studies, professional-responsibility, risk-management, safety-design, whistleblowing, technology-impact, corporate-accountability, codes-of-conduct"
0c8bb8e3-bb9c-4321-adfd-5a100b3a300a,CSE525,GA,Introduction to Graduate Algorithms,CSE,"This course is an advanced form of an introductory algorithms course, and is meant to have a thorough grounding in core Algorithms required for pursuing PG degree in Computer Science. The course covers topics such as asymptotic notation, recurrence relation, graph algorithms, heaps, dynamic programming, greedy algorithms, divide and conquer, NP-completeness where the UG contents of each topic is first reviewed in a fast-paced manner, and is followed by some advanced content.",4,CSE222,,5,monsoon,Debajyoti Bera,"[{""day"": ""Monday"", ""end_time"": ""16:30"", ""start_time"": ""15:00""}, {""day"": ""Wednesday"", ""end_time"": ""16:30"", ""start_time"": ""15:00""}]",,52:14.0,52:14.0,"advanced-algorithms, algorithm-design, approximation-algorithms, randomized-algorithms, graph-algorithms, computational-complexity, dynamic-programming, divide-and-conquer, algorithm-analysis, problem-solving"
0cae83f3-999b-4016-8341-22a4842fc9b9,ECE666,AOMML,Applied Optimization Methods for Machine Learning,ECE,"In this course, we will discuss the foundations required for solving optimization problems in the context of machine learning through various case-studies/running-examples. This course will cover basics of linear algebra required for learning optimization theory. Further, this course provides a platform to set up an optimization problem, which could be linear and nonlinear; unconstrained and constrained; convex and non-convex; continuous and discrete; deterministic and stochastic. We also cover the machine learning based context of different topics.",4,,,6,winter,Bapi Chatterjee,"[{""day"": ""Monday"", ""end_time"": ""16:30"", ""start_time"": ""15:00""}, {""day"": ""Wednesday"", ""end_time"": ""16:30"", ""start_time"": ""15:00""}]",CSE517,52:16.5,52:16.5,"optimization-methods, convex-optimization, gradient-descent, constrained-optimization, machine-learning, mathematical-programming, stochastic-optimization, duality-theory, applications-in-ml, learning-theory"
0ced5cb7-33f5-4b1f-8d6a-e54e0ad7aa2a,MTH311,CIA,Combinatorics and its Applications,MTH,"The aim of this course is to familiarize students with fundamental concepts in combinatorics, especially those used in enumeration. Topics covered include permutation groups, linear codes, Stirling and Bell numbers. Generating functions are introduced and their applications are discussed. Applications of group theory to enumeration: Burnside’s Lemma and Polya’s theory of counting are covered. Students are introduced to error correcting codes and linear codes over finite fields.",4,MTH100,,6,winter,Nabanita Ray,"[{""day"": ""Tuesday"", ""end_time"": ""11:00"", ""start_time"": ""09:30""}, {""day"": ""Friday"", ""end_time"": ""11:00"", ""start_time"": ""09:30""}]",,52:16.5,52:16.5,"combinatorics, permutations, combinations, graph-theory, recurrence-relations, inclusion-exclusion, generating-functions, extremal-combinatorics, discrete-mathematics, enumeration-techniques"
0d65cc25-52ee-46d7-a538-90bea2af1657,CSE655,NS,Network Science,CSE,"The objective of this course is to provide introduction to network science, an emerging interdisciplinary discipline with applications to vario",4,,,6,winter,Ganesh Bagler,"[{""day"": ""Monday"", ""end_time"": ""18:00"", ""start_time"": ""16:30""}, {""day"": ""Wednesday"", ""end_time"": ""18:00"", ""start_time"": ""16:30""}]",,52:14.0,52:14.0,"network-science, complex-networks, small-world-networks, centrality-measures, graph-theory, community-detection, diffusion-models, epidemic-modeling, social-networks, network-visualization"
0d6d9982-80df-494e-b9eb-94067cc7dabc,ECE517,INE,Introduction to Nanoelectronics,ECE,Nanoelectronics is an interdisciplinary area of research which has a huge potential and is currently attracting a great deal of attention. The objective of this course is to understand the basic principles that govern the operation and electrical characteristics of nanoelectronic devices and become familiar with the recent research being undertaken in nanoelectronics.,4,,,,winter,TBA,[],,52:16.5,52:16.5,"nanoelectronics, quantum-tunneling, mosfets, nanoscale-devices, semiconductor-physics, quantum-mechanics, carbon-nanotubes, spintronics, miniaturization, emerging-technologies"
0f361629-e0bf-4cec-a503-d33ae17cd16a,DES520,HCAI,Human Centred AI,DES,"This course provides a comprehensive understanding of Human-Centered Al (HAI), focusing on designing Al systems that prioritize user needs, inclusivity, and accessibility. Students will explore the integration of user-centered design principles with Al technologies to create systems that are understandable, fair, and transparent. Emphasis will be placed on addressing ethical challenges such as bias and fairness while fostering effective human-Al interactions and ensuring responsible Al development.",4,"DES204,CSE643,CSE440,CSE343,CSE543,ECE563",,6,winter,Rajiv Ratn Shah,"[{""day"": ""Wednesday"", ""end_time"": ""11:00"", ""start_time"": ""09:30""},{""day"": ""Friday"", ""end_time"": ""12:30"", ""start_time"": ""11:00""}]",,52:19.3,52:19.3,"human-centered-ai, ethical-ai, explainable-ai, human-ai-interaction, usability, inclusive-design, responsible-ai, design-thinking, fairness-in-ai, user-experience"
106bfc3c-e113-464a-a48c-722bad08d1d8,CSE624A,ICC,Introduction to Computational Complexity,CSE,"One of the many beautiful results in the theory of computation is the equivalence of ""deterministic"" and ""non-deterministic"" variants of different models of computation, like Turing machines. One may ask whether this equivalence holds if we restrict the running time (or number of steps) of a Turing machine. This gives rise to one of the most important open problems in computer science, popularly known as the P versus NP question. This will be the starting point of our course. After briefly recalling Turing machines and discussing formal definitions of the classes 'P' and 'NP', we will see the notion of 'reductions', which will allow us to talk about the 'hardest' problems in NP, known as NP-complete problems. We will discuss some important NP-complete problems from different areas like logic, graph theory, etc. After that, we will briefly talk about other important classes corresponding to the running time of a Turing machine, like 'co-NP', 'EXP', and 'NEXP'. Following this, we will see a classification of computational problems based on the space used by the Turing machine. We will discuss some important classes like PSPACE and NPSPACE (the space-variants of P and NP, respectively), their relations with P and NP, a 'PSPACE-complete' problem, the equivalence of PSPACE and NPSPACE, and other space complexity classes. Then, we will see the concept of 'polynomial hierarchy', which generalizes P, NP, and co-NP and is contained in PSPACE. If time permits, we will see a high-level introduction of randomness in computation.",4,winter,,,monsoon,TBA,[],,52:14.0,52:14.0,"computational-complexity, p-vs-np, turing-machines, complexity-classes, space-complexity, reductions, hard-problems, intractability, time-complexity, theoretical-computer-science"
11647275-ace4-412f-958f-e35e5f11e365,CSE322,ToC,Theory of Computation,CSE,"The course gives an overview over basic formal grammars and abstract machine models used in Computer Science. In particular, finite automata, pushdown automata, context-free grammars and Turing machines are studied with respect to their properties and limits. Based on Turing machines the concepts of decidability and recursive enumerability are introduced.",4,"CSE121,MTH210",,6,winter,Diptapriyo Majumdar,"[{""day"": ""Tuesday"", ""end_time"": ""16:30"", ""start_time"": ""15:00""}, {""day"": ""Thursday"", ""end_time"": ""16:30"", ""start_time"": ""15:00""}]",,52:14.0,52:14.0,"theory-of-computation, automata-theory, regular-languages, context-free-grammars, turing-machines, decidability, computational-theory, formal-languages, pushdown-automata"
